[
  {
    "id": "bms_0001",
    "component_type": "bms",
    "manufacturer": "Tesla Motors",
    "model": "Model S Battery Module BMS (PCBA 1030796)",
    "image_path": "images/bms/bms_0001.jpg",
    "source_url": "https://circuitdigest.com/article/tesla-model-s-battery-system-an-engineers-perspective",
    "license": "Educational reference",
    "notes": "",
    "features": [
      "Cell voltage monitoring",
      "Cell balancing",
      "Temperature monitoring"
    ],
    "supports_cell_count": 6,
    "date_added": "2025-11-14"
  },
  {
    "id": "chevy_bolt_bms_0001",
    "component_type": "bms",
    "manufacturer": "LG Energy Solution / GM",
    "model": "Chevrolet Bolt EV Battery Energy Control Module (BECM)",
    "image_path": "images/bms/chevy_bolt_bms_001.webp",
    "source_url": "https://www.diyelectriccar.com/threads/chevy-bolt-battery-pack-teardown.194132/",
    "license": "Educational reference",
    "notes": "",
    "features": [
      "State of charge (SOC) estimation",
      "State of health (SOH) monitoring",
      "Cell voltage and temperature monitoring",
      "Thermal management control",
      "CAN bus communication with vehicle ECU",
      "Charge current regulation"
    ],
    "supports_cell_count": 288,
    "date_added": "2026-03-12"
  },
  {
    "id": "ford_mache_bms_0001",
    "component_type": "bms",
    "manufacturer": "Ford",
    "model": "Ford Mustang Mach-E Battery Energy Control Module (BECM)",
    "image_path": "images/bms/Mach-e_bms.png",
    "source_url": "https://www.youtube.com/watch?v=3_iRpKx9VmI",
    "license": "Educational reference",
    "notes": "Ford Battery Energy Control Module (BECM) managing the Mach-E extended range 98.7kWh pack. Integrates with Ford SYNC and BlueCruise driver assistance systems. Reference from teardown video showing BECM removal and inspection.",
    "features": [
      "State of charge (SOC) estimation",
      "State of health (SOH) monitoring",
      "Cell voltage and temperature monitoring",
      "Thermal management control",
      "Ford SYNC integration",
      "CAN bus communication with vehicle ECU"
    ],
    "vehicle_models": [
      "Ford Mustang Mach-E Extended Range",
      "Ford Mustang Mach-E GT",
      "Ford F-150 Lightning"
    ],
    "date_added": "2026-03-26"
  },
  {
    "id": "hyundai_ioniq5_bms_0001",
    "component_type": "bms",
    "manufacturer": "Hyundai",
    "model": "Ioniq 5 E-GMP Battery Management System",
    "image_path": "",
    "source_url": "https://www.hyundai.co.uk/electric-cars/ioniq5",
    "license": "Educational reference",
    "notes": "E-GMP BMS managing 77.4kWh pack. Supports 800V charging and V2L power delivery.",
    "features": [
      "800V architecture support",
      "Ultra-fast charge management",
      "V2L bidirectional control",
      "Cell balancing",
      "SOH monitoring"
    ],
    "vehicle_models": [
      "Hyundai Ioniq 5",
      "Kia EV6",
      "Genesis GV60"
    ],
    "date_added": "2026-03-24"
  },
  {
    "id": "nissan_leaf_bms_0001",
    "component_type": "bms",
    "manufacturer": "Nissan",
    "model": "Leaf Gen 1 (24kWh) BMS / Comms & Balance Loom",
    "image_path": "images/bms/nissan_leaf_bms_002.jpg",
    "source_url": "https://ecotrustbatteries.co.uk/shop/nissan-leaf-battery-modules/nissan-leaf-gen-1-24kwh-battery-module-positive-on-left/",
    "license": "Educational reference",
    "notes": "",
    "features": [
      "Cell voltage monitoring",
      "Balance lead management",
      "Module communication interface"
    ],
    "supports_cell_count": 4,
    "date_added": "2026-02-27"
  },
  {
    "id": "renault_zoe_bms_0001",
    "component_type": "bms",
    "manufacturer": "Renault",
    "model": "Zoe Z.E. 50 Battery Management System",
    "image_path": "",
    "source_url": "https://www.renault.co.uk/electric-vehicles/zoe/range-and-battery.html",
    "license": "Educational reference",
    "notes": "Renault proprietary BMS for Z.E. platform managing the 52kWh pack.",
    "features": [
      "Cell balancing",
      "SOC/SOH monitoring",
      "Thermal management",
      "CAN bus"
    ],
    "vehicle_models": [
      "Renault Zoe Z.E. 50",
      "Renault Zoe Z.E. 40"
    ],
    "date_added": "2026-03-24"
  },
  {
    "id": "vw_id4_bms_0001",
    "component_type": "bms",
    "manufacturer": "Volkswagen AG",
    "model": "Volkswagen ID.4 / ID.3 Battery Management System (MEB Platform)",
    "image_path": "images/bms/ID4_bms.webp",
    "source_url": "https://www.edn.com/under-the-hood-vws-id-3-electric-vehicle/",
    "license": "Educational reference",
    "notes": "MEB platform Battery Management System as detailed in EDN teardown of the VW ID.3. Manages the 77kWh pack across 12 modules. Architecture is shared across VW Group MEB platform vehicles including the ID.4, ID.3, and Audi Q4 e-tron.",
    "features": [
      "Cell voltage monitoring",
      "Thermal management control",
      "State of health (SOH) estimation",
      "CAN bus communication with vehicle ECU",
      "Shared across VW Group MEB vehicles"
    ],
    "vehicle_models": [
      "Volkswagen ID.4",
      "Volkswagen ID.3",
      "Audi Q4 e-tron"
    ],
    "date_added": "2026-03-26"
  }
]